name,function,category,subcategory,code_url,resource_url,description,language,link_check
GTFS.org,Producing Data,GTFS,GTFS Courses,https://github.com/google/transit,https://gtfs.org,The community-driven open standard for rider-facing transit information.,EN,Reference source
"MobilityData - ""Understanding GTFS: An intro and overview""",Producing Data,GTFS,GTFS Courses,,https://www.youtube.com/watch?v=SDz2460AjNo,"This video provides an overview of of the General Transit Feed Specification (GTFS) and why it is useful for transit agencies, riders, and policymakers.",EN,Looks good
"World Bank - ""Intro. to GTFS"" online course",Producing Data,GTFS,GTFS Courses,,https://olc.worldbank.org/content/introduction-general-transit-feed-specification-gtfs-and-informal-transit-system-mapping,,EN,Behind login
Open Transit Data Toolkit,Producing Data,GTFS,GTFS Courses,,http://transitdatatoolkit.com/,,EN,Broken
ArcGIS - Introduction to GTFS,Producing Data,GTFS,GTFS Courses,,https://www.youtube.com/watch?v=8OQKHhu1VgQ&t=148s,This video talks about the basic components of GTFS data and how it relates to maps and the ArcGIS workflows we’ll be talking about in this video series.,EN,Looks good
GTFS-books,Producing Data,GTFS,GTFS Courses,https://github.com/MobilityData/GTFS-books,,"This repository contains the source for the following two books:

The Definitive Guide to GTFS (2014), 
The Definitive Guide to GTFS-realtime (2015)",EN,Reference source
MBTA GTFS Onboarding,Producing Data,GTFS,GTFS Courses,,https://mybinder.org/v2/gh/mbta/gtfs_onboarding/main?urlpath=lab/tree/GTFS_Onboarding.ipynb,With Jupyter Notebook,EN,Not sure
"Planetizen ""Building a Transit Map Web App"" course",Producing Data,GTFS,GTFS Courses,,https://courses.planetizen.com/course/building-transit-map-app,"This course examines the entire process of building an interactive, web-based mapping application.",EN,Looks good
Google Transit Developers,Producing Data,GTFS,GTFS Consumer App Guidance,,https://developers.google.com/transit/gtfs/,Google documentation overview ,EN,Looks good
Transit app Guidelines for Producing GTFS Static Data,Producing Data,GTFS,GTFS Consumer App Guidance,,https://resources.transitapp.com/article/458-guidelines-for-producing-gtfs-static-data-for-transit,"Producing GTFS doesn’t have to be a headache! By following a few guidelines, you can make sure that your GTFS data is represented in Transit (and other apps) as intended, and that you’re always providing public transit riders with the best, clearest, and most up-to-date information possible.",EN,Looks good
Bing Maps Transit - Add your transit data to Bing Maps,Producing Data,GTFS,GTFS Consumer App Guidance,,https://www.bing.com/maps/transitcontentproviders,,EN,Looks good
Yandex Maps - Transport integration,Producing Data,GTFS,GTFS Consumer App Guidance,,https://yandex.ru/support/m-maps/transport.html?lang=en#connect-display,,EN,Looks good
CGTFS,Producing Data,GTFS,GTFS Libraries - C,https://github.com/rakhack/cgtfs,,C library to read GTFS feeds,EN,Not sure
RRRR Rapid Real-time Routing,Producing Data,GTFS,GTFS Libraries - C,https://github.com/bliksemlabs/rrrr,,RRRR rapid real-time routing,EN,Looks good
just_gtfs,Producing Data,GTFS,GTFS Libraries - C++,https://github.com/mesozoic-drones/just_gtfs,,C++17 header-only library for reading and writing GTFS 🌍,EN,Looks good
ESRI public-transit-tools,Producing Data,GTFS,GTFS Libraries - C#,https://github.com/Esri/public-transit-tools,,Tools for working with GTFS public transit data in ArcGIS,EN,Looks good
GTFS Feed Parser,Producing Data,GTFS,GTFS Libraries - C#,https://github.com/OsmSharp/GTFS,http://www.itinero.tech/,.NET implementation of a General Transit Feed Specification (GTFS) feed parser.,EN,Looks good
Go GTFS Parser,Producing Data,GTFS,GTFS Libraries - Go,https://github.com/geops/gtfsparser,,A GTFS parsing library for Go,EN,Not sure
OneBusAway GTFS Modules,Producing Data,GTFS,GTFS Libraries - Java,https://github.com/OneBusAway/onebusaway-gtfs-modules/wiki,,"A Java-based library for reading, writing, and transforming public transit data in the GTFS format, including database support.",EN,Looks good
gtfs-sequelize,Producing Data,GTFS,GTFS Libraries - JavaScript,https://github.com/evansiroky/gtfs-sequelize,,A model of the static GTFS using sequelize.,EN,Looks good
gtfs-utils,Producing Data,GTFS,GTFS Libraries - JavaScript,https://github.com/public-transport/gtfs-utils,,Read & analyze GTFS datasets using Node.js.,EN,Looks good
gtfs-via-postgres,Producing Data,GTFS,GTFS Libraries - JavaScript,https://github.com/public-transport/gtfs-via-postgres,,Process GTFS Static/Schedule by importing it into a PostgreSQL database.,EN,Looks good
Node-GTFS,Producing Data,GTFS,GTFS Libraries - JavaScript,https://github.com/BlinkTagInc/node-gtfs,,"Import GTFS transit data into SQLite and query routes, stops, times, fares and more.",EN,Looks good
gtfs-schema,Producing Data,GTFS,GTFS Libraries - PostgreSQL,https://github.com/tyleragreen/gtfs-schema,,PostgreSQL schemas for GTFS feeds.,EN,Deprecated
gtfs-via-postgres,Producing Data,GTFS,GTFS Libraries - PostgreSQL,https://github.com/derhuerst/gtfs-via-postgres,,Process GTFS Static/Schedule by importing it into a PostgreSQL database.,EN,Looks good
gtfsdb,Producing Data,GTFS,GTFS Libraries - Python,https://github.com/OpenTransitTools/gtfsdb,,GTFS ORM using SQLAlchemy,EN,Looks good
gtfs_functions,Producing Data,GTFS,GTFS Libraries - Python,https://github.com/Bondify/gtfs_functions,,Package with useful functions to create geo-spatial visualizations from a GTFS.,EN,Looks good
gtfs-segments,Producing Data,GTFS,GTFS Libraries - Python,https://github.com/UTEL-UIUC/gtfs_segments,https://gtfs-segments.readthedocs.io/en/latest/,GTFS Segments: A fast and efficient library to generate bus stop spacings,EN,Looks good
gtfslib-python,Producing Data,GTFS,GTFS Libraries - Python,https://github.com/afimb/gtfslib-python,,An open source library in python for reading GTFS files and computing various stats and indicators about Public Transport networks,EN,Deprecated
gtfsman,Producing Data,GTFS,GTFS Libraries - Python,https://github.com/geops/gtfsman,,Repository-like tool to manage and update a huge number of GTFS feeds,EN,Looks good
gtfspy,Producing Data,GTFS,GTFS Libraries - Python,https://github.com/CxAalto/gtfspy,,Public transport network analysis using Python,EN,Looks good
GTFS Kit,Producing Data,GTFS,GTFS Libraries - Python,https://github.com/mrcagney/gtfs_kit,,A Python library for analyzing GTFS feeds.,EN,Looks good
Make GTFS,Producing Data,GTFS,GTFS Libraries - Python,https://github.com/mrcagney/make_gtfs,,A Python 3.8+ library to build GTFS feeds from basic route information.,EN,Looks good
Mapzen GTFS,Producing Data,GTFS,GTFS Libraries - Python,https://github.com/transitland/mapzen-gtfs,,Python library for reading and writing GTFS feeds,EN,Looks good
multigtfs,Producing Data,GTFS,GTFS Libraries - Python,https://github.com/tulsawebdevs/django-multi-gtfs,https://tulsawebdevs.org/,Django app to import and export General Transit Feed Specification (GTFS),EN,Looks good
partridge,Producing Data,GTFS,GTFS Libraries - Python,https://github.com/remix/partridge,https://partridge.readthedocs.io/en/stable/,"A fast, forgiving GTFS reader built on pandas DataFrames",EN,Looks good
transit_service_analyst,Producing Data,GTFS,GTFS Libraries - Python,https://github.com/psrc/transit_service_analyst,,Tools to support transit service analysis.,EN,Looks good
TransitGPT,Producing Data,GTFS,GTFS Libraries - Python,https://github.com/UTEL-UIUC/TransitGPT,transitgpt.streamlit.app/,TransitGPT is a specialized chatbot that helps transit enthusiasts retrieve transit information and analyze GTFS feeds via code,EN,Looks good
r-transit,Producing Data,GTFS,GTFS Libraries - R,https://github.com/r-transit,,R package for working with GTFS data,EN,Looks good
gtfsio,Producing Data,GTFS,GTFS Libraries - R,https://github.com/r-transit/gtfsio,https://r-transit.github.io/gtfsio/,Read and Write General Transit Feed Specification (GTFS),EN,Looks good
tidytransit,Producing Data,GTFS,GTFS Libraries - R,https://github.com/r-transit/tidytransit,https://r-transit.github.io/tidytransit/,"Use tidytransit to map transit stops and routes, calculate travel times and transit frequencies, and validate transit feeds. tidytransit reads the General Transit Feed Specification into tidyverse and simple features data frames. ",EN,Looks good
GTFS-viz,Producing Data,GTFS,GTFS Libraries - Ruby,https://github.com/vasile/GTFS-viz,,Converts a GTFS dataset into a SQLite DB + GeoJSONs / KMLs,EN,Looks good
gtfs-structure,Producing Data,GTFS,GTFS Libraries - Rust,https://github.com/rust-transit/gtfs-structure,,This crates brings serde structures of this model and helpers to read GTFS archives.,EN,Looks good
Chouette,Producing Data,GTFS,GTFS Converters,https://enroute.atlassian.net/wiki/spaces/PUBLIC/pages/539426886/Chouette+Convert,,"Chouette Convert is an API to convert a data file into another format (GTFS, NeTEx, Neptune, etc).",EN,Looks good
extract-gtfs-pathways,Producing Data,GTFS,GTFS Converters,https://github.com/derhuerst/extract-gtfs-pathways,,Command-line tool to extract pathways from a GTFS dataset.,EN,Looks good
extract-gtfs-shapes,Producing Data,GTFS,GTFS Converters,https://github.com/derhuerst/extract-gtfs-shapes,,Extract shapes from a GTFS dataset.,EN,Looks good
GTFS-OSM-Sync,Producing Data,GTFS,GTFS Converters,https://github.com/CUTR-at-USF/gtfs-osm-sync,,Synchronizes public transportation data in GTFS format with OpenStreetMap.org,EN,Deprecated
gtfs-parser,Producing Data,GTFS,GTFS Converters,https://github.com/ioTransit/gtfs-parser,,An updated version of gtfs2geojson in typescript,EN,Looks good
gtfs-service-area,Producing Data,GTFS,GTFS Converters,https://github.com/cal-itp/gtfs-service-area,,Compute transit service area from static GTFS.,EN,Deprecated
GTFS-route-shapes,Producing Data,GTFS,GTFS Converters,https://github.com/kotrc/GTFS-route-shapes,,A simple script to generate a single geoJSON shape for each transit route in a GTFS archive.,EN,Looks good
gtfs-to-geojson,Producing Data,GTFS,GTFS Converters,https://github.com/BlinkTagInc/gtfs-to-geojson,,Generate geoJSON of transit route data from a GTFS file.,EN,Looks good
gtfs2gps,Producing Data,GTFS,GTFS Converters,https://github.com/ipeaGIT/gtfs2gps,https://ipeagit.github.io/gtfs2gps/,Convert GTFS data into a data.table with GPS-like records in R,EN,Looks good
gtfs2emis,Producing Data,GTFS,GTFS Converters,https://github.com/ipeaGIT/gtfs2emis,https://ipeagit.github.io/gtfs2emis/,R package to estimate public transport emissions based on GTFS data,EN,Looks good
gtsf,Producing Data,GTFS,GTFS Converters,https://github.com/r-gtfs/gtsf,,NOTE: deprecated. see tidytransit. General Transit - Simple Features,EN,Deprecated
hafas-generate-gtfs,Producing Data,GTFS,GTFS Converters,https://github.com/derhuerst/hafas-generate-gtfs,,[work in progress] – Generate GTFS dumps from HAFAS endpoints.,EN,Looks good
Hafas2GTFS,Producing Data,GTFS,GTFS Converters,https://github.com/geops/hafas2gtfs,,"Hafas2GTFS converter, optimized for SBB HAFAS feeds",EN,Deprecated
kml-to-gtfs-shapes,Producing Data,GTFS,GTFS Converters,https://github.com/bdferris/kml-to-gtfs-shapes/tree/gh-pages,http://bdferris.github.io/kml-to-gtfs-shapes/,Simple utility to convert a KML file into a GTFS shapes.txt file.,EN,Not sure
NeTEx-to-GTFS Converter Java,Producing Data,GTFS,GTFS Converters,https://github.com/entur/netex-gtfs-converter-java,,Convert a NeTEx dataset into a GTFS dataset,EN,Looks good
o2g,Producing Data,GTFS,GTFS Converters,https://github.com/hiposfer/o2g,,Convert a NeTEx dataset into a GTFS dataset,EN,Looks good
Open-Transport SYNTHESE Convertors,Producing Data,GTFS,GTFS Converters,https://github.com/Open-Transport/synthese/wiki,,"SYNTHESE is a public transportation server. It provides network modelling, passenger information, DRT reservation, CMS, real time data updating, and operations optimization.","EN, FR",Deprecated
onebusaway-gtfs-to-barefoot,Producing Data,GTFS,GTFS Converters,https://github.com/OneBusAway/onebusaway-gtfs-to-barefoot,,A Java application that takes a GTFS file and produces a Barefoot map file,EN,Looks good
onebusaway-vdv-modules,Producing Data,GTFS,GTFS Converters,https://github.com/OneBusAway/onebusaway-vdv-modules,,Libraries and tools for working with transit data conforming to the VDV specification.,EN,Looks good
osm2gtfs,Producing Data,GTFS,GTFS Converters,https://github.com/grote/osm2gtfs,,Turn OpenStreetMap data and schedule information into GTFS. Use public transport data from OpenStreetMap and external schedule information to create a General Transit Feed (GTFS).,EN,Looks good
transit_model,Producing Data,GTFS,GTFS Converters,https://github.com/hove-io/transit_model,,"transit_model is a Rust crate to manage, convert and enrich transit data.
This is done by implementing the NTFS model (used in navitia).",EN,Looks good
transloc-gtfs-rectifier,Producing Data,GTFS,GTFS Converters,https://github.com/laidig/transloc-gtfs-rectifier,,Rectify transloc-specific stop ids with nearby ones in a GTFS feed.,EN,Looks good
Transmodel and IFF to GTFS,Producing Data,GTFS,GTFS Converters,https://github.com/bliksemlabs/bliksemintegration,,,EN,Looks good
Transporter-Project transxchange-to-gtfs,Producing Data,GTFS,GTFS Converters,https://github.com/Transporter-Project/transxchange-to-gtfs,,Converts TransXChange XML files to GTFS CSV files.,EN,Looks good
TXC TransXChange publisher (UK Department for Transport),Producing Data,GTFS,GTFS Converters,,https://www.gov.uk/government/publications/transxchange-publisher,UK nationwide standard for exchanging bus schedules and related data.,EN,Looks good
UK2GTFS,Producing Data,GTFS,GTFS Converters,,https://itsleeds.github.io/UK2GTFS/,"UK2GTFS is an R package to convert and work with train, tram, bus, ferry, and metro timetable data from the unfriendly and difficult to use formats used in the UK to the easy to use GTFS format. The main purpose of developing the package is to support using OpenTripPlanner in the UK.",EN,Looks good
AddTransit,Producing Data,GTFS,GTFS Data Collection and Maintenance Tools,,https://addtransit.com/gtfs-transit-file.php,"Get your schedules appearing on Online Maps, Journey Planners and Apps",EN,Behind login
bus-router,Producing Data,GTFS,GTFS Data Collection and Maintenance Tools,https://github.com/atlregional/bus-router,,"Ever come across a GTFS feed without the optional shapes.txt file? bus-router creates a shapes.txt file for stop_times.txt using OSRM. The routing isn't always perfect, but it gets the dirty parts out of the way.",EN,Looks good
gtfs-blocks-to-transfers,Producing Data,GTFS,GTFS Data Collection and Maintenance Tools,https://github.com/TransitApp/GTFS-blocks-to-transfers,,Converts GTFS blocks into a series of trip-to-trip transfers using heuristics to classify transfer type.,EN,Looks good
GTFS Diff,Producing Data,GTFS,GTFS Data Collection and Maintenance Tools,https://github.com/etalab/transport-site/,https://transport.data.gouv.fr/tools/gtfs_diff,GTFS Diff is a specification created by transport.data.gouv.fr and aims at providing a simple and unified way to express differences between GTFS files.,"EN, FR",Looks good
GTFS Editor,Producing Data,GTFS,GTFS Data Collection and Maintenance Tools,https://github.com/ibi-group/datatools-ui,https://data-tools-docs.ibi-transit.com/en/latest/,"The core application for IBI Group's TRANSIT-Data-Tools suite. This application provides GTFS editing, management, validation, and deployment to OpenTripPlanner.",EN,Looks good
GTFS Editor for Vagrant,Producing Data,GTFS,GTFS Data Collection and Maintenance Tools,https://github.com/laidig/vagrant-gtfs-editor,,"The GTFS Editor works reasonably well, but has a quirk in that it relies on the non-current Java version 7, which will be not supported in the near future. Due to a history of vulnerabilities, running an unsupported Java version is not recommended. Vagrant offers a way to quickly and automatically set up a virtual machine environment to run this software only when necessesary.",EN,Looks good
static-GTFS-manager,Producing Data,GTFS,GTFS Data Collection and Maintenance Tools,https://github.com/WRI-Cities/static-GTFS-manager,https://manage.transitlink.org/,"GUI interface for creating, editing, exporting of static GTFS data for a public transit authority",EN,Looks good
TransitWand,Producing Data,GTFS,GTFS Data Collection and Maintenance Tools,https://github.com/conveyal/transit-wand,,"A mobile platform for collecting transit data -- GTFS, passenger counts and GIS data.",EN,Looks good
IBI Data Tools Infra,Producing Data,GTFS,GTFS Data Collection and Maintenance Tools,https://github.com/cal-itp/ibi-datatools-infra,,Initial development of Kubernetes configuration for IBI Datatools,EN,Looks good
GTFS.html,Producing Data,GTFS,GTFS Data Collection and Maintenance Tools,https://github.com/thatsmydoing/gtfs.html,https://gtfs.pleasantprogrammer.com,This website lets you view and explore the contents of a GTFS file right in your browser. Simply drop a GTFS file into the area below to open it.,EN,Not sure
pfaedle,Producing Data,GTFS,GTFS Data Collection and Maintenance Tools,https://github.com/ad-freiburg/pfaedle,https://travic.app/?z=7&x=1261608.6&y=6430601.6&l=osm_standard&ol=,Precise map-matching for public transit feeds. Generates high-quality GTFS shapes from OSM data.,EN,Looks good
GTFS shape mapfit,Producing Data,GTFS,GTFS Data Collection and Maintenance Tools,https://github.com/HSLdevcom/gtfs_shape_mapfit,,OTP dataloading runs an integrated gtfs-osm stop matching task.,EN,Deprecated
GTFS Builder,Producing Data,GTFS,GTFS Data Collection and Maintenance Tools,,http://nationalrtap.org/Web-Apps/GTFS-Builder,GTFS Builder is a free Microsoft Excel-based web application which assists rural and tribal transit agencies to develop and generate fully valid GTFS for their bus routes. ,EN,Behind login
gtfs-station-builder,Producing Data,GTFS,GTFS Data Collection and Maintenance Tools,https://github.com/kostjerry/gtfs-station-builder,,UI tool to help build the internal structure of stations (based on GTFS standard),EN,Looks good
GTFS Text-to-Speech Tester,Producing Data,GTFS,GTFS Data Collection and Maintenance Tools,https://github.com/BlinkTagInc/node-gtfs-tts,,Review GTFS stop pronunciations to determine which stops need a tts_stop_name value.,EN,Looks good
Spare GTFS-Flex Builder,Producing Data,GTFS,GTFS Data Collection and Maintenance Tools,,https://sparelabs.com/en/spare-gtfs-flex-builder,"Create and export GTFS-Flex data for free, making it easier for riders to discover your on-demand services.",EN,Behind paywall
Swiftly,Producing Data,GTFS,GTFS Data Collection and Maintenance Tools,,https://goswift.ly/,"Power your network with the industry’s leading data platform for knowing where your vehicles were, are, and will be next",EN,Behind paywall
Chouette SaaS,Producing Data,GTFS,GTFS Data Collection and Maintenance Tools,https://bitbucket.org/enroute-mobi/chouette-core,,,EN,Looks good
Ara SaaS,Producing Data,GTFS,GTFS Data Collection and Maintenance Tools,https://bitbucket.org/enroute-mobi/ara,,"Modular architecture organized in Collection, Model & Broadcast. Multi-protocol connectors: SIRI, SIRI Lite (GTFS-RT soon). Real time Visualization / management of data by API.",EN,Looks good
Amarillo,Producing Data,GTFS,GTFS Data Collection and Maintenance Tools,https://github.com/mfdz/amarillo,https://amarillo.mfdz.de/,Aggregates and enhances carpooling-offers and publishes them as GTFS(-RT),"EN, DE",Looks good
combine_gtfs_feeds,Producing Data,GTFS,GTFS Merge Tools,https://github.com/psrc/combine_gtfs_feeds,,A tool to combine gtfs feeds into one feed/dataset. The main purpose of combine_gtfs_feeds is to be able work from one GTFS feed when performing transit service analysis for a particular geographic location.,EN,Looks good
GTFS Kit,Producing Data,GTFS,GTFS Merge Tools,https://github.com/mrcagney/gtfs_kit,,GTFS Kit is a Python 3.10+ library for analyzing General Transit Feed Specification (GTFS) data in memory without a database. It uses Pandas and GeoPandas to do the heavy lifting.,EN,Looks good
Transitfeed merge function,Producing Data,GTFS,GTFS Merge Tools,https://github.com/google/transitfeed/wiki/Merge,,"The GTFS Merge tool allows users to combine multiple GTFS feeds from different service periods into one continuous schedule, though major stop changes may cause issues.",EN,Deprecated
gtfsmerge,Producing Data,GTFS,GTFS Merge Tools,https://github.com/now8-org/gtfsmerge,,Script to merge GTFS ZIP archives into one.,EN,Looks good
gtfstools,Producing Data,GTFS,GTFS Analysis Tools,https://github.com/ipeaGIT/gtfstools,https://ipeagit.github.io/gtfstools/,"gtfstools offers a set of convenient tools for editing and analysing transit feeds in GTFS format. Feeds are read as a list of data.tables, allowing for easy and fast data manipulation. Many of this package’s features are based on functions from other packages, especially {tidytransit} and {gtfs2gps}.
",EN,Looks good
transit_service_analyst,Producing Data,GTFS,GTFS Analysis Tools,https://github.com/psrc/transit_service_analyst,https://pypi.org/project/transit-service-analyst/,"transit_service_analyst is a python library that provides access to GTFS files as Pandas DataFrames & GeoPandas GeoDataFrames for a specific date, as well as several functions that should help bootstrap a wide array of service related analysis, including geospatial analysis.",EN,Looks good
Peartree,Producing Data,GTFS,GTFS Analysis Tools,https://github.com/kuanb/peartree,,A library for converting GTFS feed schedules into a representative directed network graph. The tool uses Partridge to convert the target operator schedule data into Pandas dataframes and then NetworkX to hold the manipulated schedule data as a directed multigraph.,EN,Looks good
R5: Rapid Realistic Routing on Real-world and Reimagined networks,Producing Data,GTFS,GTFS Analysis Tools,https://github.com/conveyal/r5,https://conveyal.com/learn,"Developed to power Conveyal's web-based interface for scenario planning and land-use/transport accessibility analysis, R5 is our routing engine for multimodal networks with a particular focus on public transit",EN,Behind login
tidytransit,Producing Data,GTFS,GTFS Analysis Tools,https://github.com/r-transit/tidytransit,https://r-transit.github.io/tidytransit/,"Use tidytransit to map transit stops and routes, calculate travel times and transit frequencies, and validate transit feeds. Tidytransit reads the General Transit Feed Specification into tidyverse and simple features data frames.",EN,Looks good
transitr,Producing Data,GTFS,GTFS Analysis Tools,https://github.com/tmelliott/transitr,,An R package for constructing and modelling a transit network in real time to obtain vehicle ETAs,EN,Looks good
transit-intensity,Producing Data,GTFS,GTFS Analysis Tools,https://github.com/ioTransit/transit-intensity,,A simple project for measuring transit intensity,EN,Looks good
Busbuzzard,Producing Data,GTFS,GTFS Analysis Tools,https://github.com/bmander/busbuzzard,,Inference of probabilistic schedules from empirical data about transit vehicles.,EN,Not sure
GTFS-to-Chart,Producing Data,GTFS,GTFS Analysis Tools,https://github.com/BlinkTagInc/gtfs-to-chart,,Generate stringline charts from GTFS transit data,EN,Looks good
GTFS Display,Producing Data,GTFS,GTFS Analysis Tools,https://codeberg.org/dancingCycle/gtfs-display,,Display data from GTFS files.,EN,Looks good
PTNA,Producing Data,GTFS,GTFS Analysis Tools,https://github.com/osm-ToniE,https://wiki.openstreetmap.org/wiki/Public_Transport_Network_Analysis,Public Transport Network Analysis. An open-source system for finding and aggregating information about public transportation lines mapped in OpenStreetMap (OSM).,EN,Looks good
GTFS-to-HTML,Producing Data,GTFS,Timetable Publishing,,https://gtfstohtml.com,Generate human-readable HTML timetables from GTFS,EN,Looks good
Timetable Kit,Producing Data,GTFS,Timetable Publishing,https://github.com/neroden/timetable_kit,,A Python toolkit for generating human-readable timetables from GTFS data; uses PANDAS and gtfs_kit,EN,Looks good
TimeTablePublisher (TTPUB),Producing Data,GTFS,Timetable Publishing,https://github.com/OpenTransitTools/ttpub,,"The TimeTablePublisher (TTPUB) is a web publishing system that allows a transit agency to examine, modify, and transform raw scheduling data into easy-to-read timetables for customer information purposes. The application simplifies and accelerates the production of printed on-street schedules and web schedules, which is often a very time-consuming and manual process for most agencies. This results in more accurate, current, and consistent schedule information for the customer.",EN,Looks good
Conveyal's gtfs-validator,Producing Data,GTFS,GTFS Validators,https://github.com/conveyal/gtfs-validator,,A Java framework for GTFS validation and statistics.,EN,Deprecated
Conveyal's gtfs-lib,Producing Data,GTFS,GTFS Validators,https://github.com/conveyal/gtfs-lib/,,A library for loading and saving GTFS feeds of arbitrary size with disk-backed storage,EN,Looks good
GTFS Data Package Specification,Producing Data,GTFS,GTFS Validators,https://github.com/Stephen-Gates/GTFS,,"Public transport data in GTFS format with schemas, a data package and tests",EN,Deprecated
gtfstidy,Producing Data,GTFS,GTFS Validators,https://github.com/patrickbr/gtfstidy,,"A tool for checking, sanitizing and minimizing GTFS feeds.",EN,Looks good
gtfsclean,Producing Data,GTFS,GTFS Validators,https://github.com/public-transport/gtfsclean,,"Tidy (and validate) GTFS feeds. Fixes small inconsistencies, minimizes the overall feed size, and prepares the feed for secure, standard-compliant further use.",EN,Looks good
